<?xml version="1.0" encoding="UTF-8"?>
<!--W3C Schema generated by XMLSPY v5 rel. 4 U (http://www.xmlspy.com)-->
<xs:schema xmlns:xs="http://www.w3.org/2001/XMLSchema" elementFormDefault="qualified"
	xmlns:xlink="http://www.w3.org/1999/xlink" 
	xmlns:xml="http://www.w3.org/XML/1998/namespace"
>
 <xs:import namespace="http://www.w3.org/1999/xlink" schemaLocation="http://www.oasis-open.org/committees/ebxml-msg/schema/xlink.xsd" /> 
<xs:import namespace="http://www.w3.org/XML/1998/namespace"  schemaLocation="http://www.w3.org/2001/xml.xsd"/>
	<xs:element name="trace">
		<xs:complexType>
		  <xs:attribute ref="xlink:type" fixed="simple" /> 
 		 <xs:attribute ref="xlink:href" use="required" /> 
		</xs:complexType>
	</xs:element>
	<xs:element name="traces">
		<xs:complexType>
			<xs:sequence>
				<xs:element name="trace" ref="trace" minOccurs="1" maxOccurs="unbounded"/>
			</xs:sequence>
			<xs:attribute ref="xml:base"  use="optional"/> 
		</xs:complexType>
	</xs:element>
</xs:schema>
